<?xml version="1.0" encoding="UTF-8"?>
<s:site version="" xmlns:s="http://zend-sdk.googlecode.com/site-descriptor/1.0" xmlns:xsi="http://www.w3.org/2001/XMLSchema-instance" xsi:schemaLocation="http://zend-sdk.googlecode.com/site-descriptor/1.0 repository.xsd ">
  <description>My Example Application Site</description>
  <s:artifact name="org.zend.drupal" version="6.19" url="/drupal/drupal-6.19.zpk">
    <size>1328376</size>
    <signature>67b6c6fd6d565758d2f997e7d91d320b</signature>
    <category>cms</category>
    <provider>bcquia</provider>
  </s:artifact>
  <s:category-def name="cms" label="Control Managment System" >
    <description>Description of Control Managment System</description>
  </s:category-def>
  <s:provider-def label="Bcquia" name="bcquia">
    <icon>http://my.fake//my.png</icon>
    <url>http://www.zend.com</url>
    <description>description of the application</description>
  </s:provider-def>
</s:site>
